Sheet: Счет
B1: Поставщик (исполнитель) | C1: ##Мы_Имя##
B2: Телефон | C2: 180-02-01 (с 14:00 до 18:00)
B3: Адрес | C3: ##Мы_ЮрАдрес##
B4: Расчетный счет № | C4: ##Мы_БанковскиеРеквизиты##
B5: Город | C5: Москва
B6: ИНН | C6: ##Мы_ИНН##
B7: ППП | C7: ##Мы_КПП##
B10: Покупатель (заказчик) | C10: =Фирма -> ##Фирма_Имя##
B11: Адрес | C11: =ЮрАдрес -> ##Фирма_ЮрАдрес##
B12: ИНН покупателя | C12: =ИНН -> ##Фирма_ИНН##
B13: КПП | C13: =КПП -> ##Фирма_КПП##
B14: Примечание | C14: Убедительно посим оплачивать счета отдельными платежными поручениями
C15: Счет
C16: Номер документа | E16: Дата составления
C17: =ПолныйНомер -> ##Номер## | E17: =Дата -> ##Дата##
A19: № | B19: Товар | C19: Количес-тво (масса нетто) | D19: Цена, руб.коп. (с НДС) | E19: Сумма без учета НДС, руб. коп. | F19: НДС | H19: Сумма с учетом НДС руб. коп.
A20: п/п | B20: Наименование, характеристика, сорт, артикул товара | F20: Ставка, % | G20: сумма, руб. коп.
A21: 1 | B21: =RC[-1]+1 -> 2 | C21: =RC[-1]+1 -> 3 | D21: =RC[-1]+1 -> 4 | E21: =RC[-1]+1 -> 5 | F21: =RC[-1]+1 -> 6 | G21: =RC[-1]+1 -> 7 | H21: =RC[-1]+1 -> 8
A22: 1 | B22: =Товар -> ##Товар_Имя## | C22: =Количество -> ##Фирма_Количество## | D22: =Цена -> ##Товар_КонечнаяЦена## | E22: =RC[3]-RC[2] -> #VALUE! | F22: =СтавкаНДС -> 0 | G22: =RC[1] / (100+RC[-1]) * RC[-1] -> #VALUE! | H22: =RC[-5]*RC[-4] -> #VALUE!
B23: Итого | C23: =SUM(R[-1]C:R[-1]C) -> 0 | D23: Х | E23: =SUM(R[-1]C:R[-1]C) -> #VALUE! | F23: Х | G23: =SUM(R[-1]C:R[-1]C) -> #VALUE! | H23: =SUM(R[-1]C:R[-1]C) -> #VALUE!
B24: ##Товар_СуммаПрописью##
B25: М.П.
C26: Ген. Директор ________________________ (Чистяков В.Ю.)
C27: должность | D27: пропись | F27: расшифровка подписи

Sheet: Накладная
B2: ='Счет-фактура'!R[8]C[12] & ", " & 'Счет-фактура'!R[9]C[8] -> ##Мы_Имя##, ##Мы_ЮрАдрес## | O2: КОД
F3: организация, адрес | N3: Форма по ОКУД | O3: 330212
B4: =Счет!RC[1] -> ##Мы_БанковскиеРеквизиты## | N4: по ОКПО
B7: Грузоотправитель | C7: ='Счет-фактура'!R[3]C[11] & ", " & 'Счет-фактура'!R[4]C[7] -> ##Мы_Имя##, ##Мы_ЮрАдрес##
C8: наименование организации, адрес, номер телефона, банковские реквизиты | N8: Вид деятельности по ОКДП
B9: Поставщик | C9: ='Счет-фактура'!R[1]C[11] -> ##Мы_Имя##
B11: Плательщик | C11: =Фирма & ", " & ЮрАдрес -> ##Фирма_Имя##, ##Фирма_ЮрАдрес##
C12: наименование организации, адрес, номер телефона, банковские реквизиты
B13: ИНН плательщика | C13: =ИНН -> ##Фирма_ИНН## | I13: КПП | J13: =КПП -> ##Фирма_КПП## | N13: номер
B14: Основание | C14: ________ № _______/________ от | N14: дата
N15: номер
N16: Вид операции
F18: Номер документа | H18: Дата составления
B19: ТОВАРНАЯ НАКЛАДНАЯ | F19: =ПолныйНомер -> ##Номер## | H19: =Дата -> ##Дата##
A21: № | B21: Товар | D21: Единица измерения | F21: Вид упако-вки | G21: Количество | I21: Масса брутто | J21: Количес-тво (масса нетто) | K21: Цена, руб.коп. (с НДС) | L21: Сумма без учета НДС, руб. коп. | M21: НДС | O21: Сумма с учетом НДС руб. коп.
A22: п/п | B22: Наименование, характеристика, сорт, артикул товара | C22: код | D22: Наимено-вание | E22: Код по ОКЕИ | G22: в одном месте | H22: мест, штук | M22: Ставка, % | N22: сумма, руб. коп.
A23: 1 | B23: 2 | C23: 3 | D23: 4 | E23: 5 | F23: 6 | G23: 7 | H23: 8 | I23: 9 | J23: 10 | K23: 11 | L23: 12 | M23: 13 | N23: 14 | O23: 15
A24: 1 | B24: =Товар -> ##Товар_Имя## | J24: =Количество -> ##Фирма_Количество## | K24: =Цена -> ##Товар_КонечнаяЦена## | L24: =RC[3]-RC[2] -> #VALUE! | M24: =СтавкаНДС -> 0 | N24: =RC[1] / (100+RC[-1]) * RC[-1] -> #VALUE! | O24: =RC[-5]*RC[-4] -> #VALUE!
G25: Итого | J25: =SUM(R[-1]C:R[-1]C) -> 0 | K25: Х | L25: =SUM(R[-1]C:R[-1]C) -> #VALUE! | M25: Х | N25: =SUM(R[-1]C:R[-1]C) -> #VALUE! | O25: =SUM(R[-1]C:R[-1]C) -> #VALUE!
E26: Всего по накладной | K26: Х | M26: Х
B28: Товарная накладная не имеет приложений и содержит один лист
F29: Масса груза (нетто) | K29: По доверенности | L29: № ________ от "____"__________ г.
B30: Всего мест _____________ | F30: Масса груза (брутто) | K30: Выданной
B31: прописью | G31: прописью | L31: кем, кому (организация, должность, ФИО)
B32: Всего отпущено на сумму | K32: Груз принял | L32: __________ | M32: ________ | N32: ___________________
L33: должность | M33: пропись | N33: рсшифровка подписи
B35: Отпуск разрешил | C35: Ген. Директор __________ (Чистяков В.Ю.) | K35: Груз получил
C36: должность | E36: пропись | G36: рсшифровка подписи | K36: грузоплучатель | L36: __________ | M36: ________ | N36: ___________________
B37: Груз отправил грузоотправитель | C37: Ген. Директор __________ (Чистяков В.Ю.) | L37: должность | M37: пропись | N37: рсшифровка подписи
C38: должность | E38: пропись | G38: рсшифровка подписи
B39: М.П. | K39: М.П.

Sheet: Счет-фактура
DL1: Приложение № 1
DL2: к Правилам ведения журналов учета
DL3: полученных и выставленных счетов-фактур,
DL4: книг покупок и книг продаж при расчетах
DL5: по налогу на добавленную стоимость
DL6: (в ред. Постановлений Правительства РФ от 15.03.2001 № 189, от 27.07.2002 № 575, от 16.02.2004 № 84)
BD8: СЧЕТ-ФАКТУРА № | BE8: =Реквизиты!R[-7]C[-55] -> ##Номер## | BO8: от | BU8: =Дата -> ##Дата##
B10: Продавец | N10: ##Мы_Имя## | DB10: (2)
B11: Адрес | J11: ##Мы_ЮрАдрес## | DB11: (2а)
B12: ИНН/КПП продавца | Y12: ИНН | AF12: ##Мы_ИНН## | AV12: КПП | BB12: ##Мы_КПП## | DB12: (2б)
B13: Грузоотправитель и его адрес | AL13: тот же | DB13: (3)
B14: Грузополучатель и его адрес | AJ14: =R[2]C[-20] & ", " & R[3]C[-26] -> ##Фирма_Имя##, ##Фирма_ЮрАдрес## | DB14: (4)
B15: К платежно-расчетному документу № | BE15: от | DB15: (5)
B16: Покупатель | P16: =Фирма -> ##Фирма_Имя## | DB16: (6)
B17: Адрес | J17: =ЮрАдрес -> ##Фирма_ЮрАдрес## | DB17: (6а)
B18: ИНН/КПП покупателя | AA18: ИНН | AH18: =ИНН -> ##Фирма_ИНН## | AX18: КПП | BD18: =КПП -> ##Фирма_КПП## | DB18: (6б)
EY19: Руб.
A20: Наименование товара (описание выполненных работ, оказанных услуг) | Y20: Единица измерения | AI20: Коли- чество | AS20: Цена (тариф) за единицу измерения | BG20: Стоимость товаров (работ, услуг), всего без налога | BY20: В том числе акциз | CJ20: Налоговая ставка % | CU20: Сумма налога | DG20: Стоимость товаров (работ, услуг), всего с учетом налога | EA20: Страна происхождения | EQ20: Номер грузовой таможенной декларации
A21: 1 | Y21: 2 | AI21: 3 | AS21: 4 | BG21: 5 | BY21: 6 | CJ21: 7 | CU21: 8 | DG21: 9 | EA21: 10 | EQ21: 11
A22: =Реквизиты!R[-18]C[1] -> ##Товар_Имя## | Y22: шт. | AI22: =Количество -> ##Фирма_Количество## | AS22: =Цена -> ##Товар_КонечнаяЦена## | BG22: =RC[-24]*RC[-14]/(100+RC[29])*100 -> #VALUE! | CJ22: =СтавкаНДС -> 0 | DG22: =RC[-76]*RC[-66] -> #VALUE!
A23: Всего к оплате | DG23: =SUM(R[-1]C:R[-1]C[19]) -> #VALUE!
B25: Руководитель организации | AY25: Чистяков В.Ю. | CK25: Главный бухгалтер | DZ25: Чистяков В.Ю.
AF26: (подпись) | AY26: (ф.и.о.) | DG26: (подпись) | DZ26: (ф.и.о.)
B27: Индивидуальный предприниматель
AN28: (подпись) | BG28: (ф.и.о.)
B29: Реквизиты свидетельства о государственной
B30: регистрации индивидуального предпринимателя
B34: Примечание. Первый экземпляр - покупателю, второй экземпляр - продавцу.

Sheet: Реквизиты
A1: Префикс | B1: ##Номер##
A2: Номер
A3: Дата | B3: ##Дата##
A4: Товар | B4: ##Товар_Имя##
A5: Количество | B5: ##Фирма_Количество##
A6: Цена | B6: ##Товар_КонечнаяЦена##
A7: СтавкаНДС | B7: 0
A8: Фирма | B8: ##Фирма_Имя##
A9: ЮрАдрес | B9: ##Фирма_ЮрАдрес##
A10: ИНН | B10: ##Фирма_ИНН##
A11: КПП | B11: ##Фирма_КПП##
A12: Цена за номер | B12: ##Товар_Цена##
A13: Скидка | B13: ##Фирма_Скидка##
A14: Сумма | B14: ##Товар_Сумма##